{
  "meta": {
    "configVersion": "1.0",
    "nodeId": "media-input",
    "displayName": "多媒体输入",
    "description": "支持音频文件上传，为ASR节点提供标准格式输出",
    "author": "system",
    "version": "1.1.0",
    "tags": ["media", "input", "upload", "audio"]
  },
  "node": {
    "type": "media-input",
    "label": "多媒体输入",
    "icon": "📁",
    "description": "上传音频文件并传递给下游节点",
    "category": "input",
    "theme": "green"
  },
  "inputSchema": {
    "userInput": {
      "type": "any",
      "required": false,
      "description": "用户输入的内容（可选）"
    }
  },
  "outputSchema": {
    "content": {
      "type": "File",
      "description": "标准File对象，可直接传递给ASR节点"
    },
    "metadata": {
      "type": "object",
      "description": "文件元数据信息"
    }
  },
  "fields": [
    {
      "name": "inputType",
      "type": "select",
      "label": "输入类型",
      "defaultValue": "file",
      "required": true,
      "options": [
        { "value": "file", "label": "文件上传" },
        { "value": "url", "label": "URL链接" }
      ],
      "description": "选择输入方式"
    },
    {
      "name": "mediaFile",
      "type": "file",
      "label": "上传音频文件",
      "required": false,
      "description": "选择要上传的音频文件",
      "accept": "audio/*,.wav,.mp3,.m4a,.aac,.flac,.ogg"
    },
    {
      "name": "urlInput",
      "type": "url", 
      "label": "音频链接",
      "required": false,
      "placeholder": "https://example.com/audio.wav",
      "description": "输入音频文件的URL地址"
    },
    {
      "name": "outputFormat",
      "type": "select",
      "label": "输出格式",
      "defaultValue": "standard",
      "required": false,
      "options": [
        { "value": "standard", "label": "标准File对象（推荐）" },
        { "value": "base64", "label": "Base64编码" },
        { "value": "url", "label": "Blob URL" }
      ],
      "description": "选择传递给下游节点的格式"
    },
    {
      "name": "enablePreview",
      "type": "checkbox",
      "label": "启用预览",
      "defaultValue": true,
      "required": false,
      "description": "是否显示音频预览播放器"
    }
  ],
  "execution": {
    "type": "local",
    "handler": "media_input_handler",
    "timeout": 30,
    "retry": 1
  },
  "nodeUI": {
    "showPreview": true,
    "previewType": "audio",
    "actions": [
      {
        "id": "play",
        "label": "播放",
        "icon": "▶️",
        "action": "play",
        "condition": "isAudio"
      },
      {
        "id": "download",
        "label": "下载",
        "icon": "📥",
        "action": "download",
        "condition": "hasFile"
      }
    ]
  },
  "components": {
    "main": {
      "type": "dynamic",
      "fallback": "text-input"
    },
    "config": {
      "type": "dynamic",
      "fallback": null
    }
  },
  "data": {
    "defaultData": {
      "inputType": "file",
      "mediaFile": null,
      "urlInput": "",
      "outputFormat": "standard",
      "enablePreview": true
    },
    "validation": {
      "required": ["inputType"],
      "rules": {
        "inputType": {
          "type": "string",
          "enum": ["file", "url"]
        },
        "outputFormat": {
          "type": "string",
          "enum": ["standard", "base64", "url"]
        }
      }
    }
  },
  "dependencies": {
    "apis": [],
    "libraries": ["audio-preview"],
    "permissions": ["file-read", "url-access"]
  }
}